{
  "schema_version": "0.1.0",
  "run_id": "RUN-OFS003-PILOT-005",
  "predecessor_run_id": "RUN-OFS003-PILOT-004",
  "followup_plan_id": "CFP-DD2271E2D80B",
  "followup_plan_snapshot_ref": "runs/RUN-OFS003-PILOT-005/inputs/reviews/followups/RUN-OFS003-PILOT-004-center-gaps.json",
  "evaluated_at": "2026-08-23T19:41:09.042135Z",
  "status": "partially-effective",
  "query_count": 15,
  "effective_query_count": 6,
  "ineffective_query_count": 9,
  "field_outcomes": {
    "improved": 5,
    "refreshed": 5,
    "unchanged": 50,
    "regressed": 0
  },
  "queries": [
    {
      "query_id": "FOLLOWUP-CENTER-AIST-IHF",
      "center_id": "CENTER-AIST-IHF",
      "search_generation": 1,
      "effective": false,
      "previous_profile_ref": "proposals/center-profiles/RUN-OFS003-PILOT-004/CENTER-AIST-IHF.json",
      "current_profile_ref": "proposals/center-profiles/RUN-OFS003-PILOT-005/CENTER-AIST-IHF.json",
      "field_results": [
        {
          "field": "power",
          "previous_status": "unknown",
          "current_status": "unknown",
          "outcome": "unchanged"
        },
        {
          "field": "facility",
          "previous_status": "unknown",
          "current_status": "unknown",
          "outcome": "unchanged"
        },
        {
          "field": "migration",
          "previous_status": "partial",
          "current_status": "partial",
          "outcome": "unchanged"
        },
        {
          "field": "data_connectivity",
          "previous_status": "partial",
          "current_status": "partial",
          "outcome": "unchanged"
        }
      ]
    },
    {
      "query_id": "FOLLOWUP-CENTER-HOKKAIDO-IIC",
      "center_id": "CENTER-HOKKAIDO-IIC",
      "search_generation": 1,
      "effective": false,
      "previous_profile_ref": "proposals/center-profiles/RUN-OFS003-PILOT-004/CENTER-HOKKAIDO-IIC.json",
      "current_profile_ref": "proposals/center-profiles/RUN-OFS003-PILOT-005/CENTER-HOKKAIDO-IIC.json",
      "field_results": [
        {
          "field": "refresh_window",
          "previous_status": "partial",
          "current_status": "partial",
          "outcome": "unchanged"
        },
        {
          "field": "power",
          "previous_status": "unknown",
          "current_status": "unknown",
          "outcome": "unchanged"
        },
        {
          "field": "facility",
          "previous_status": "partial",
          "current_status": "partial",
          "outcome": "unchanged"
        },
        {
          "field": "migration",
          "previous_status": "partial",
          "current_status": "partial",
          "outcome": "unchanged"
        }
      ]
    },
    {
      "query_id": "FOLLOWUP-CENTER-ISM-CSST",
      "center_id": "CENTER-ISM-CSST",
      "search_generation": 1,
      "effective": false,
      "previous_profile_ref": "proposals/center-profiles/RUN-OFS003-PILOT-004/CENTER-ISM-CSST.json",
      "current_profile_ref": "proposals/center-profiles/RUN-OFS003-PILOT-005/CENTER-ISM-CSST.json",
      "field_results": [
        {
          "field": "refresh_window",
          "previous_status": "partial",
          "current_status": "partial",
          "outcome": "unchanged"
        },
        {
          "field": "power",
          "previous_status": "unknown",
          "current_status": "unknown",
          "outcome": "unchanged"
        },
        {
          "field": "migration",
          "previous_status": "unknown",
          "current_status": "unknown",
          "outcome": "unchanged"
        },
        {
          "field": "data_connectivity",
          "previous_status": "partial",
          "current_status": "partial",
          "outcome": "unchanged"
        }
      ]
    },
    {
      "query_id": "FOLLOWUP-CENTER-JAMSTEC-CEIST",
      "center_id": "CENTER-JAMSTEC-CEIST",
      "search_generation": 1,
      "effective": false,
      "previous_profile_ref": "proposals/center-profiles/RUN-OFS003-PILOT-004/CENTER-JAMSTEC-CEIST.json",
      "current_profile_ref": "proposals/center-profiles/RUN-OFS003-PILOT-005/CENTER-JAMSTEC-CEIST.json",
      "field_results": [
        {
          "field": "refresh_window",
          "previous_status": "unknown",
          "current_status": "unknown",
          "outcome": "unchanged"
        },
        {
          "field": "power",
          "previous_status": "unknown",
          "current_status": "unknown",
          "outcome": "unchanged"
        },
        {
          "field": "facility",
          "previous_status": "partial",
          "current_status": "partial",
          "outcome": "unchanged"
        },
        {
          "field": "migration",
          "previous_status": "unknown",
          "current_status": "unknown",
          "outcome": "unchanged"
        }
      ]
    },
    {
      "query_id": "FOLLOWUP-CENTER-JCAHPC",
      "center_id": "CENTER-JCAHPC",
      "search_generation": 1,
      "effective": false,
      "previous_profile_ref": "proposals/center-profiles/RUN-OFS003-PILOT-004/CENTER-JCAHPC.json",
      "current_profile_ref": "proposals/center-profiles/RUN-OFS003-PILOT-005/CENTER-JCAHPC.json",
      "field_results": [
        {
          "field": "power",
          "previous_status": "unknown",
          "current_status": "unknown",
          "outcome": "unchanged"
        },
        {
          "field": "facility",
          "previous_status": "partial",
          "current_status": "partial",
          "outcome": "unchanged"
        },
        {
          "field": "migration",
          "previous_status": "unknown",
          "current_status": "unknown",
          "outcome": "unchanged"
        },
        {
          "field": "data_connectivity",
          "previous_status": "unknown",
          "current_status": "unknown",
          "outcome": "unchanged"
        }
      ]
    },
    {
      "query_id": "FOLLOWUP-CENTER-KYOTO-ACCMS",
      "center_id": "CENTER-KYOTO-ACCMS",
      "search_generation": 1,
      "effective": false,
      "previous_profile_ref": "proposals/center-profiles/RUN-OFS003-PILOT-004/CENTER-KYOTO-ACCMS.json",
      "current_profile_ref": "proposals/center-profiles/RUN-OFS003-PILOT-005/CENTER-KYOTO-ACCMS.json",
      "field_results": [
        {
          "field": "power",
          "previous_status": "partial",
          "current_status": "partial",
          "outcome": "unchanged"
        },
        {
          "field": "facility",
          "previous_status": "partial",
          "current_status": "partial",
          "outcome": "unchanged"
        },
        {
          "field": "migration",
          "previous_status": "unknown",
          "current_status": "unknown",
          "outcome": "unchanged"
        },
        {
          "field": "software",
          "previous_status": "unknown",
          "current_status": "unknown",
          "outcome": "unchanged"
        }
      ]
    },
    {
      "query_id": "FOLLOWUP-CENTER-KYUSHU-RIIT",
      "center_id": "CENTER-KYUSHU-RIIT",
      "search_generation": 1,
      "effective": true,
      "previous_profile_ref": "proposals/center-profiles/RUN-OFS003-PILOT-004/CENTER-KYUSHU-RIIT.json",
      "current_profile_ref": "proposals/center-profiles/RUN-OFS003-PILOT-005/CENTER-KYUSHU-RIIT.json",
      "field_results": [
        {
          "field": "refresh_window",
          "previous_status": "unknown",
          "current_status": "unknown",
          "outcome": "unchanged"
        },
        {
          "field": "power",
          "previous_status": "unknown",
          "current_status": "unknown",
          "outcome": "unchanged"
        },
        {
          "field": "migration",
          "previous_status": "unknown",
          "current_status": "unknown",
          "outcome": "unchanged"
        },
        {
          "field": "software",
          "previous_status": "unknown",
          "current_status": "verified",
          "outcome": "improved"
        }
      ]
    },
    {
      "query_id": "FOLLOWUP-CENTER-NAGOYA-ITC",
      "center_id": "CENTER-NAGOYA-ITC",
      "search_generation": 1,
      "effective": true,
      "previous_profile_ref": "proposals/center-profiles/RUN-OFS003-PILOT-004/CENTER-NAGOYA-ITC.json",
      "current_profile_ref": "proposals/center-profiles/RUN-OFS003-PILOT-005/CENTER-NAGOYA-ITC.json",
      "field_results": [
        {
          "field": "power",
          "previous_status": "unknown",
          "current_status": "unknown",
          "outcome": "unchanged"
        },
        {
          "field": "facility",
          "previous_status": "unknown",
          "current_status": "verified",
          "outcome": "improved"
        },
        {
          "field": "migration",
          "previous_status": "partial",
          "current_status": "partial",
          "outcome": "unchanged"
        },
        {
          "field": "data_connectivity",
          "previous_status": "unknown",
          "current_status": "verified",
          "outcome": "improved"
        }
      ]
    },
    {
      "query_id": "FOLLOWUP-CENTER-OSAKA-D3",
      "center_id": "CENTER-OSAKA-D3",
      "search_generation": 1,
      "effective": true,
      "previous_profile_ref": "proposals/center-profiles/RUN-OFS003-PILOT-004/CENTER-OSAKA-D3.json",
      "current_profile_ref": "proposals/center-profiles/RUN-OFS003-PILOT-005/CENTER-OSAKA-D3.json",
      "field_results": [
        {
          "field": "power",
          "previous_status": "partial",
          "current_status": "partial",
          "outcome": "unchanged"
        },
        {
          "field": "migration",
          "previous_status": "partial",
          "current_status": "partial",
          "outcome": "refreshed"
        },
        {
          "field": "data_connectivity",
          "previous_status": "unknown",
          "current_status": "partial",
          "outcome": "improved"
        },
        {
          "field": "software",
          "previous_status": "unknown",
          "current_status": "unknown",